[
{
"id": "ENG_CHUNK_1001",
"chunk": "There's something to be said for [verb-ing]",
"category": "sentence_frame",
"pragmatic_function": "Conceding the merit of something",
"register": "neutral",
"natural_example": "There's something to be said for staying home on New Year's Eve.",
"cefr_level": "B2"
},
{
"id": "ENG_CHUNK_1002",
"chunk": "It comes down to [noun]",
"category": "sentence_frame",
"pragmatic_function": "Identifying the deciding factor",
"register": "neutral",
"natural_example": "For me, it comes down to the price.",
"cefr_level": "B2"
},
{
"id": "ENG_CHUNK_1003",
"chunk": "Don't take it out on [person]",
"category": "sentence_frame",
"pragmatic_function": "Objecting to being blamed for someone's mood",
"register": "informal",
"natural_example": "I know you had a bad day, but don't take it out on me.",
"cefr_level": "B2"
},
{
"id": "ENG_CHUNK_1004",
"chunk": "It's considered rude to [base-verb]",
"category": "sentence_frame",
"pragmatic_function": "Explaining a social norm",
"register": "neutral",
"natural_example": "In some countries, it's considered rude to eat while you're walking.",
"cefr_level": "B2"
},
{
"id": "ENG_CHUNK_1005",
"chunk": "I'd like to think [clause]",
"category": "sentence_frame",
"pragmatic_function": "Stating a hopeful belief about yourself or others",
"register": "neutral",
"natural_example": "I'd like to think I'm a pretty good cook.",
"cefr_level": "B2"
},
{
"id": "ENG_CHUNK_1006",
"chunk": "There's no such thing as [noun]",
"category": "sentence_frame",
"pragmatic_function": "Denying that something exists",
"register": "neutral",
"natural_example": "There's no such thing as a perfect apartment.",
"cefr_level": "B2"
},
{
"id": "ENG_CHUNK_1007",
"chunk": "Don't let [noun] get to you",
"category": "sentence_frame",
"pragmatic_function": "Telling someone not to be upset by something",
"register": "informal",
"natural_example": "Don't let one bad review get to you.",
"cefr_level": "B2"
},
{
"id": "ENG_CHUNK_1008",
"chunk": "Why would [person] [base-verb]?",
"category": "sentence_frame",
"pragmatic_function": "Questioning someone's motive",
"register": "neutral",
"natural_example": "Why would she lie about something so small?",
"cefr_level": "B2"
},
{
"id": "ENG_CHUNK_1009",
"chunk": "What's stopping you from [verb-ing]?",
"category": "sentence_frame",
"pragmatic_function": "Encouraging someone to act",
"register": "informal",
"natural_example": "You hate your job. What's stopping you from looking for a new one?",
"cefr_level": "B2"
},
{
"id": "ENG_CHUNK_1010",
"chunk": "Whatever happened to [noun]?",
"category": "sentence_frame",
"pragmatic_function": "Asking what became of someone or something",
"register": "informal",
"natural_example": "Whatever happened to that guy you used to work with?",
"cefr_level": "B2"
},
{
"id": "ENG_CHUNK_1011",
"chunk": "You know [noun] I told you about?",
"category": "sentence_frame",
"pragmatic_function": "Referring back to shared knowledge",
"register": "informal",
"natural_example": "You know that coffee shop I told you about? It closed.",
"cefr_level": "B2"
},
{
"id": "ENG_CHUNK_1012",
"chunk": "As for [noun], [clause]",
"category": "sentence_frame",
"pragmatic_function": "Shifting to another item",
"register": "neutral",
"natural_example": "As for dinner, I was thinking we could just order in.",
"cefr_level": "B2"
},
{
"id": "ENG_CHUNK_1013",
"chunk": "It's funny you should mention [noun]",
"category": "sentence_frame",
"pragmatic_function": "Noting a coincidence in conversation",
"register": "neutral",
"natural_example": "It's funny you should mention Portland. I'm going there next week.",
"cefr_level": "B2"
},
{
"id": "ENG_CHUNK_1014",
"chunk": "If you're ever in [noun], [clause]",
"category": "sentence_frame",
"pragmatic_function": "Inviting someone to visit",
"register": "neutral",
"natural_example": "If you're ever in Chicago, you should come stay with us.",
"cefr_level": "B2"
},
{
"id": "ENG_CHUNK_1015",
"chunk": "It's amazing how [clause]",
"category": "sentence_frame",
"pragmatic_function": "Marveling at something",
"register": "neutral",
"natural_example": "It's amazing how fast the kids grow up.",
"cefr_level": "B2"
},
{
"id": "ENG_CHUNK_1016",
"chunk": "I'm not asking you to [base-verb]",
"category": "sentence_frame",
"pragmatic_function": "Limiting what you are asking for",
"register": "neutral",
"natural_example": "I'm not asking you to cook every night, just once a week.",
"cefr_level": "B2"
},
{
"id": "ENG_CHUNK_1017",
"chunk": "What are the odds [clause]?",
"category": "sentence_frame",
"pragmatic_function": "Remarking on a coincidence",
"register": "informal",
"natural_example": "What are the odds we'd end up on the same flight?",
"cefr_level": "B2"
},
{
"id": "ENG_CHUNK_1018",
"chunk": "I can't get over [noun]",
"category": "sentence_frame",
"pragmatic_function": "Expressing lingering amazement",
"register": "informal",
"natural_example": "I can't get over the view from your balcony.",
"cefr_level": "B2"
},
{
"id": "ENG_CHUNK_1019",
"chunk": "You should have seen [noun]",
"category": "sentence_frame",
"pragmatic_function": "Emphasizing something remarkable you witnessed",
"register": "informal",
"natural_example": "You should have seen the look on his face.",
"cefr_level": "B2"
},
{
"id": "ENG_CHUNK_1020",
"chunk": "How [adjective] is that?",
"category": "sentence_frame",
"pragmatic_function": "Emphasizing a reaction",
"register": "informal",
"natural_example": "They upgraded us for free. How cool is that?",
"cefr_level": "B2"
},
{
"id": "ENG_CHUNK_1021",
"chunk": "You'd have to be [adjective] to [base-verb]",
"category": "sentence_frame",
"pragmatic_function": "Saying only a fool would do something",
"register": "informal",
"natural_example": "You'd have to be crazy to drive in this snow.",
"cefr_level": "B2"
},
{
"id": "ENG_CHUNK_1022",
"chunk": "Say what you want about [person], [clause]",
"category": "sentence_frame",
"pragmatic_function": "Conceding criticism before praising",
"register": "informal",
"natural_example": "Say what you want about my uncle, he's always there when you need him.",
"cefr_level": "B2"
},
{
"id": "ENG_CHUNK_1023",
"chunk": "It got to the point where [clause]",
"category": "sentence_frame",
"pragmatic_function": "Describing an escalation",
"register": "neutral",
"natural_example": "It got to the point where I couldn't sleep at all.",
"cefr_level": "B2"
},
{
"id": "ENG_CHUNK_1024",
"chunk": "I was halfway through [verb-ing] when [clause]",
"category": "sentence_frame",
"pragmatic_function": "Narrating an interruption",
"register": "neutral",
"natural_example": "I was halfway through cooking dinner when the power went out.",
"cefr_level": "B2"
},
{
"id": "ENG_CHUNK_1025",
"chunk": "I've heard good things about [noun]",
"category": "sentence_frame",
"pragmatic_function": "Reporting a positive reputation",
"register": "neutral",
"natural_example": "I've heard good things about that Thai place on Main Street.",
"cefr_level": "B2"
},
{
"id": "ENG_CHUNK_1026",
"chunk": "Is it too much to ask for [noun]?",
"category": "sentence_frame",
"pragmatic_function": "Voicing exasperation at an unmet request",
"register": "informal",
"natural_example": "Is it too much to ask for a little quiet in the evening?",
"cefr_level": "B2"
},
{
"id": "ENG_CHUNK_1027",
"chunk": "[person] wanted to know [clause]",
"category": "sentence_frame",
"pragmatic_function": "Reporting someone's question",
"register": "neutral",
"natural_example": "My mom wanted to know when you're coming to visit.",
"cefr_level": "B2"
},
{
"id": "ENG_CHUNK_1028",
"chunk": "[person] was like, [clause]",
"category": "sentence_frame",
"pragmatic_function": "Quoting someone informally",
"register": "informal",
"natural_example": "So I told him, and he was like, why didn't you say something sooner?",
"cefr_level": "B2"
},
{
"id": "ENG_CHUNK_1029",
"chunk": "Rumor has it [clause]",
"category": "sentence_frame",
"pragmatic_function": "Passing on gossip",
"register": "informal",
"natural_example": "Rumor has it the office is closing early on Friday.",
"cefr_level": "B2"
},
{
"id": "ENG_CHUNK_1030",
"chunk": "I got [person] to [base-verb]",
"category": "sentence_frame",
"pragmatic_function": "Reporting that you persuaded someone",
"register": "neutral",
"natural_example": "I got my dad to see a doctor about his back.",
"cefr_level": "B2"
},
{
"id": "ENG_CHUNK_1031",
"chunk": "I didn't expect [person] to [base-verb]",
"category": "sentence_frame",
"pragmatic_function": "Expressing surprise at someone's action",
"register": "neutral",
"natural_example": "I didn't expect so many people to show up.",
"cefr_level": "B2"
},
{
"id": "ENG_CHUNK_1032",
"chunk": "I can't imagine [verb-ing]",
"category": "sentence_frame",
"pragmatic_function": "Saying something is unthinkable",
"register": "neutral",
"natural_example": "I can't imagine living without a car out here.",
"cefr_level": "B2"
},
{
"id": "ENG_CHUNK_1033",
"chunk": "[noun] is nothing like [noun]",
"category": "sentence_frame",
"pragmatic_function": "Stressing a big difference",
"register": "neutral",
"natural_example": "Homemade pasta is nothing like the stuff from a box.",
"cefr_level": "B2"
},
{
"id": "ENG_CHUNK_1034",
"chunk": "The more I [base-verb], the more I [base-verb]",
"category": "sentence_frame",
"pragmatic_function": "Describing a growing correlation",
"register": "neutral",
"natural_example": "The more I read about it, the more I worry.",
"cefr_level": "B2"
},
{
"id": "ENG_CHUNK_1035",
"chunk": "It's one thing to [base-verb], but it's another to [base-verb]",
"category": "sentence_frame",
"pragmatic_function": "Contrasting what is easy with what is hard",
"register": "neutral",
"natural_example": "It's one thing to buy a treadmill, but it's another to actually use it.",
"cefr_level": "B2"
},
{
"id": "ENG_CHUNK_1036",
"chunk": "to set a goal",
"category": "collocation",
"pragmatic_function": "Committing to a target",
"register": "neutral",